{
 "generated_at": "2026-10-18T11:45:17Z",
 "sources": [
  {
   "name": "NASA Exoplanet Archive, Planetary Systems Composite Parameters (pscomppars)",
   "url": "https://exoplanetarchive.ipac.caltech.edu/",
   "citation": "NASA Exoplanet Archive, operated by Caltech under contract with NASA; TAP query on pscomppars",
   "terms": "Public; the archive asks users to acknowledge it (https://exoplanetarchive.ipac.caltech.edu/docs/acknowledge.html)"
  }
 ],
 "orbiters": [
  {
   "name": "Mars Global Surveyor",
   "years": "1997 to 2006",
   "instruments": "MOLA laser altimeter; TES thermal emission spectrometer",
   "used_for": "MOLA heights (low ground, slope, the globe and map relief); TES nighttime thermal inertia (plume-safe ground) and albedo (dust)"
  },
  {
   "name": "Mars Odyssey",
   "years": "since 2001",
   "instruments": "THEMIS; neutron spectrometer",
   "used_for": "THEMIS daytime infrared mosaics (site thumbnails); neutron hydrogen counts inside the SWIM ice maps"
  },
  {
   "name": "Mars Reconnaissance Orbiter",
   "years": "since 2006",
   "instruments": "HiRISE; CTX; SHARAD radar",
   "used_for": "HiRISE images of the six 2019 candidate sites; SHARAD radar and CTX landforms inside the SWIM ice maps"
  }
 ],
 "worlds": [
  {
   "id": "earth",
   "name": "Earth",
   "kind": "home",
   "status": "live",
   "order": 0,
   "parent": null,
   "host_star": "Sun",
   "spectral_type": "G2 V",
   "distance_ly": 0.0,
   "radius_earth": 1.0,
   "mass_earth": 1.0,
   "eq_temp_k": null,
   "insolation_earth": 1.0,
   "orbital_period_days": 365.25,
   "discovered": null,
   "method": null,
   "facts": [
    "Story County, Iowa: 136 real fields, a plan every morning"
   ],
   "tagline": "The satellite visits every farm. Every farmer gets a morning plan.",
   "source": null,
   "sites": null,
   "illustration": false
  },
  {
   "id": "mars",
   "name": "Mars",
   "kind": "planet",
   "status": "open",
   "order": 1,
   "parent": null,
   "host_star": "Sun",
   "spectral_type": "G2 V",
   "distance_ly": null,
   "radius_earth": 0.532,
   "mass_earth": 0.107,
   "eq_temp_k": null,
   "insolation_earth": 0.43,
   "orbital_period_days": 687.0,
   "discovered": null,
   "method": null,
   "facts": [
    "A day lasts 24 hours 39 minutes",
    "Gravity is 38 percent of Earth's",
    "Surface pressure is under 1 percent of Earth's"
   ],
   "tagline": "The next home. A city on Mars starts with one landing: near water, through enough air to slow down, on ground that holds.",
   "source": "NASA Mars facts",
   "sites": "out/mars/sites.json",
   "illustration": false
  },
  {
   "id": "europa",
   "name": "Europa",
   "kind": "ocean_moon",
   "status": "coming_soon",
   "order": 2,
   "parent": "Jupiter",
   "host_star": "Sun",
   "spectral_type": "G2 V",
   "distance_ly": null,
   "radius_earth": null,
   "mass_earth": null,
   "eq_temp_k": null,
   "insolation_earth": null,
   "orbital_period_days": null,
   "discovered": null,
   "method": null,
   "facts": [
    "An ice shell over a global ocean"
   ],
   "tagline": "Jupiter's ice moon: a global ocean under the shell.",
   "source": null,
   "sites": null,
   "illustration": true
  },
  {
   "id": "enceladus",
   "name": "Enceladus",
   "kind": "ocean_moon",
   "status": "coming_soon",
   "order": 3,
   "parent": "Saturn",
   "host_star": "Sun",
   "spectral_type": "G2 V",
   "distance_ly": null,
   "radius_earth": null,
   "mass_earth": null,
   "eq_temp_k": null,
   "insolation_earth": null,
   "orbital_period_days": null,
   "discovered": null,
   "method": null,
   "facts": [
    "Water plumes from a subsurface ocean"
   ],
   "tagline": "Saturn's small moon that sprays its ocean into space.",
   "source": null,
   "sites": null,
   "illustration": true
  },
  {
   "id": "titan",
   "name": "Titan",
   "kind": "ocean_moon",
   "status": "coming_soon",
   "order": 4,
   "parent": "Saturn",
   "host_star": "Sun",
   "spectral_type": "G2 V",
   "distance_ly": null,
   "radius_earth": null,
   "mass_earth": null,
   "eq_temp_k": null,
   "insolation_earth": null,
   "orbital_period_days": null,
   "discovered": null,
   "method": null,
   "facts": [
    "A thick atmosphere, methane lakes, a subsurface ocean"
   ],
   "tagline": "Saturn's largest moon: thick air, methane lakes, an ocean below.",
   "source": null,
   "sites": null,
   "illustration": true
  },
  {
   "id": "proxima-cen-b",
   "name": "Proxima Cen b",
   "kind": "exoplanet",
   "status": "coming_soon",
   "order": 5,
   "parent": null,
   "host_star": "Proxima Cen",
   "spectral_type": "M5.5 V",
   "distance_ly": 4.2,
   "radius_earth": 1.02,
   "mass_earth": 1.05,
   "eq_temp_k": 218.0,
   "insolation_earth": 0.64,
   "orbital_period_days": 11.18,
   "discovered": 2016,
   "method": "Radial Velocity",
   "facts": [
    "4.2 light-years away",
    "1.02 times Earth's radius",
    "equilibrium temperature about 218 K",
    "a year lasts 11.2 days",
    "found in 2016 by radial velocity"
   ],
   "tagline": "Proxima Cen b orbits Proxima Cen, 4.2 light-years from here.",
   "source": "NASA Exoplanet Archive, pscomppars, fetched 2026-10-18",
   "sites": null,
   "illustration": true
  },
  {
   "id": "ross-128-b",
   "name": "Ross 128 b",
   "kind": "exoplanet",
   "status": "coming_soon",
   "order": 6,
   "parent": null,
   "host_star": "Ross 128",
   "spectral_type": "M4",
   "distance_ly": 11.0,
   "radius_earth": 1.11,
   "mass_earth": 1.4,
   "eq_temp_k": 301.0,
   "insolation_earth": 1.38,
   "orbital_period_days": 9.87,
   "discovered": 2017,
   "method": "Radial Velocity",
   "facts": [
    "11 light-years away",
    "1.11 times Earth's radius",
    "equilibrium temperature about 301 K",
    "a year lasts 9.9 days",
    "found in 2017 by radial velocity"
   ],
   "tagline": "Ross 128 b orbits Ross 128, 11 light-years from here.",
   "source": "NASA Exoplanet Archive, pscomppars, fetched 2026-10-18",
   "sites": null,
   "illustration": true
  },
  {
   "id": "teegardens-star-b",
   "name": "Teegarden's Star b",
   "kind": "exoplanet",
   "status": "coming_soon",
   "order": 7,
   "parent": null,
   "host_star": "Teegarden's Star",
   "spectral_type": "M7.0 V",
   "distance_ly": 12.5,
   "radius_earth": 1.05,
   "mass_earth": 1.16,
   "eq_temp_k": 277.0,
   "insolation_earth": 1.08,
   "orbital_period_days": 4.91,
   "discovered": 2019,
   "method": "Radial Velocity",
   "facts": [
    "12.5 light-years away",
    "1.05 times Earth's radius",
    "equilibrium temperature about 277 K",
    "a year lasts 4.9 days",
    "found in 2019 by radial velocity"
   ],
   "tagline": "Teegarden's Star b orbits Teegarden's Star, 12.5 light-years from here.",
   "source": "NASA Exoplanet Archive, pscomppars, fetched 2026-10-18",
   "sites": null,
   "illustration": true
  },
  {
   "id": "wolf-1069-b",
   "name": "Wolf 1069 b",
   "kind": "exoplanet",
   "status": "coming_soon",
   "order": 8,
   "parent": null,
   "host_star": "Wolf 1069",
   "spectral_type": "M5.0 V",
   "distance_ly": 31.3,
   "radius_earth": 1.08,
   "mass_earth": 1.26,
   "eq_temp_k": 250.0,
   "insolation_earth": 0.65,
   "orbital_period_days": 15.56,
   "discovered": 2023,
   "method": "Radial Velocity",
   "facts": [
    "31.3 light-years away",
    "1.08 times Earth's radius",
    "equilibrium temperature about 250 K",
    "a year lasts 15.6 days",
    "found in 2023 by radial velocity"
   ],
   "tagline": "Wolf 1069 b orbits Wolf 1069, 31.3 light-years from here.",
   "source": "NASA Exoplanet Archive, pscomppars, fetched 2026-10-18",
   "sites": null,
   "illustration": true
  },
  {
   "id": "trappist-1-e",
   "name": "TRAPPIST-1 e",
   "kind": "exoplanet",
   "status": "coming_soon",
   "order": 9,
   "parent": null,
   "host_star": "TRAPPIST-1",
   "spectral_type": "M8.0 V",
   "distance_ly": 40.5,
   "radius_earth": 0.92,
   "mass_earth": 0.69,
   "eq_temp_k": 250.0,
   "insolation_earth": 0.65,
   "orbital_period_days": 6.1,
   "discovered": 2017,
   "method": "Transit",
   "facts": [
    "40.5 light-years away",
    "0.92 times Earth's radius",
    "equilibrium temperature about 250 K",
    "a year lasts 6.1 days",
    "found in 2017 by transit"
   ],
   "tagline": "TRAPPIST-1 e orbits TRAPPIST-1, 40.5 light-years from here.",
   "source": "NASA Exoplanet Archive, pscomppars, fetched 2026-10-18",
   "sites": null,
   "illustration": true
  },
  {
   "id": "trappist-1-f",
   "name": "TRAPPIST-1 f",
   "kind": "exoplanet",
   "status": "coming_soon",
   "order": 10,
   "parent": null,
   "host_star": "TRAPPIST-1",
   "spectral_type": "M8.0 V",
   "distance_ly": 40.5,
   "radius_earth": 1.04,
   "mass_earth": 1.04,
   "eq_temp_k": 218.0,
   "insolation_earth": 0.37,
   "orbital_period_days": 9.21,
   "discovered": 2017,
   "method": "Transit",
   "facts": [
    "40.5 light-years away",
    "1.04 times Earth's radius",
    "equilibrium temperature about 218 K",
    "a year lasts 9.2 days",
    "found in 2017 by transit"
   ],
   "tagline": "TRAPPIST-1 f orbits TRAPPIST-1, 40.5 light-years from here.",
   "source": "NASA Exoplanet Archive, pscomppars, fetched 2026-10-18",
   "sites": null,
   "illustration": true
  },
  {
   "id": "trappist-1-g",
   "name": "TRAPPIST-1 g",
   "kind": "exoplanet",
   "status": "coming_soon",
   "order": 11,
   "parent": null,
   "host_star": "TRAPPIST-1",
   "spectral_type": "M8.0 V",
   "distance_ly": 40.5,
   "radius_earth": 1.13,
   "mass_earth": 1.32,
   "eq_temp_k": 197.0,
   "insolation_earth": 0.25,
   "orbital_period_days": 12.35,
   "discovered": 2017,
   "method": "Transit",
   "facts": [
    "40.5 light-years away",
    "1.13 times Earth's radius",
    "equilibrium temperature about 197 K",
    "a year lasts 12.4 days",
    "found in 2017 by transit"
   ],
   "tagline": "TRAPPIST-1 g orbits TRAPPIST-1, 40.5 light-years from here.",
   "source": "NASA Exoplanet Archive, pscomppars, fetched 2026-10-18",
   "sites": null,
   "illustration": true
  },
  {
   "id": "lhs-1140-b",